UC1- ABILITY TO CREATE A ADDRESS BOOK SERVICE DB
->
mysql> create database addressbookservice;
Query OK, 1 row affected (0.01 sec)

mysql> show databases;
+--------------------+
| Database           |
+--------------------+
| addressbookservice |
| information_schema |
| mysql              |
| payroll_service    |
| performance_schema |
| sakila             |
| sys                |
| world              |
+--------------------+
8 rows in set (0.00 sec)

mysql> use addressbookservice;
Database changed

UC2- ABILITY TO CREATE A ADDRESS BOOK TABLE with first and
last names, address, city,
state, zip, phone number
and email as its attributes

->
mysql> create table contact_book
    -> (
    -> firstname VARCHAR(50) NOT NULL,
    -> lastname VARCHAR(50),
    -> address VARCHAR(50),
    -> city varchar(50) NOT NULL,
    -> state varchar(50) NOT NULL,
    -> zip INT NOT NULL,
    -> phonenumber varchar(50) not null,
    -> email varchar(50) not null,
    -> PRIMARY KEY(firstname));
Query OK, 0 rows affected (0.04 sec)

mysql> describe contact_book
    -> ;
+-------------+-------------+------+-----+---------+-------+
| Field       | Type        | Null | Key | Default | Extra |
+-------------+-------------+------+-----+---------+-------+
| firstname   | varchar(50) | NO   | PRI | NULL    |       |
| lastname    | varchar(50) | YES  |     | NULL    |       |
| address     | varchar(50) | YES  |     | NULL    |       |
| city        | varchar(50) | NO   |     | NULL    |       |
| state       | varchar(50) | NO   |     | NULL    |       |
| zip         | int         | NO   |     | NULL    |       |
| phonenumber | varchar(50) | NO   |     | NULL    |       |
| email       | varchar(50) | NO   |     | NULL    |       |
+-------------+-------------+------+-----+---------+-------+
8 rows in set (0.01 sec)

UC3-Ability to insert new
Contacts to Address
Book

->mysql> insert into contact_book values('Ruchi','Mandve','Sanpada','Navi Mumbai','Maharashtra',400705,'9892735509','ruchimandve07@gmail.com');
Query OK, 1 row affected (0.01 sec)

mysql> select * from contact_book;
+-----------+----------+---------+-------------+-------------+--------+-------------+-------------------------+
| firstname | lastname | address | city        | state       | zip    | phonenumber | email                   |
+-----------+----------+---------+-------------+-------------+--------+-------------+-------------------------+
| Ruchi     | Mandve   | Sanpada | Navi Mumbai | Maharashtra | 400705 | 9892735509  | ruchimandve07@gmail.com |
+-----------+----------+---------+-------------+-------------+--------+-------------+-------------------------+
1 row in set (0.00 sec)

mysql> insert into contact_book values('Prachi','Mandve','Vashi','Navi Mumbai','Maharashtra',400703,'9967734725','prachimandve07@gmail.com');
Query OK, 1 row affected (0.01 sec)

mysql> insert into contact_book values('Prajakta','Tambe','Kalamboli','Panvel','Maharashtra',410218,'8104706110','prajtambe@gmail.com');
Query OK, 1 row affected (0.01 sec)

mysql> select * from contact_book;
+-----------+----------+-----------+-------------+-------------+--------+-------------+--------------------------+
| firstname | lastname | address   | city        | state       | zip    | phonenumber | email                    |
+-----------+----------+-----------+-------------+-------------+--------+-------------+--------------------------+
| Prachi    | Mandve   | Vashi     | Navi Mumbai | Maharashtra | 400703 | 9967734725  | prachimandve07@gmail.com |
| Prajakta  | Tambe    | Kalamboli | Panvel      | Maharashtra | 410218 | 8104706110  | prajtambe@gmail.com      |
| Ruchi     | Mandve   | Sanpada   | Navi Mumbai | Maharashtra | 400705 | 9892735509  | ruchimandve07@gmail.com  |
+-----------+----------+-----------+-------------+-------------+--------+-------------+--------------------------+
3 rows in set (0.00 sec)


UC4-Ability to edit
existing contact
person using their name

->
mysql> select * from contact_book;
+-----------+----------+-----------+-------------+-------------+--------+-------------+--------------------------+
| firstname | lastname | address   | city        | state       | zip    | phonenumber | email                    |
+-----------+----------+-----------+-------------+-------------+--------+-------------+--------------------------+
| Prachi    | Mandve   | Vashi     | Navi Mumbai | Maharashtra | 400703 | 9967734725  | prachimandve07@gmail.com |
| Prajakta  | Tambe    | Kalamboli | Panvel      | Maharashtra | 410218 | 8104706110  | prajtambe@gmail.com      |
| Ruchi     | Mandve   | Sanpada   | Navi Mumbai | Maharashtra | 400705 | 9892735509  | ruchimandve07@gmail.com  |
+-----------+----------+-----------+-------------+-------------+--------+-------------+--------------------------+
3 rows in set (0.00 sec)

mysql> update contact_book set address='Koperkhairne' where name='Prachi';
ERROR 1054 (42S22): Unknown column 'name' in 'where clause'
mysql> update contact_book set address='Koperkhairne' where firstname='Prachi';
Query OK, 1 row affected (0.01 sec)
Rows matched: 1  Changed: 1  Warnings: 0

mysql> select * from contact_book;
+-----------+----------+--------------+-------------+-------------+--------+-------------+--------------------------+
| firstname | lastname | address      | city        | state       | zip    | phonenumber | email                    |
+-----------+----------+--------------+-------------+-------------+--------+-------------+--------------------------+
| Prachi    | Mandve   | Koperkhairne | Navi Mumbai | Maharashtra | 400703 | 9967734725  | prachimandve07@gmail.com |
| Prajakta  | Tambe    | Kalamboli    | Panvel      | Maharashtra | 410218 | 8104706110  | prajtambe@gmail.com      |
| Ruchi     | Mandve   | Sanpada      | Navi Mumbai | Maharashtra | 400705 | 9892735509  | ruchimandve07@gmail.com  |
+-----------+----------+--------------+-------------+-------------+--------+-------------+--------------------------+
3 rows in set (0.00 sec)

UC5-Ability to delete a
person using person's name

->mysql> select * from contact_book;
+-----------+----------+--------------+-------------+-------------+--------+-------------+--------------------------+
| firstname | lastname | address      | city        | state       | zip    | phonenumber | email                    |
+-----------+----------+--------------+-------------+-------------+--------+-------------+--------------------------+
| Prachi    | Mandve   | Koperkhairne | Navi Mumbai | Maharashtra | 400703 | 9967734725  | prachimandve07@gmail.com |
| Prajakta  | Tambe    | Kalamboli    | Panvel      | Maharashtra | 410218 | 8104706110  | prajtambe@gmail.com      |
| Ruchi     | Mandve   | Sanpada      | Navi Mumbai | Maharashtra | 400705 | 9892735509  | ruchimandve07@gmail.com  |
+-----------+----------+--------------+-------------+-------------+--------+-------------+--------------------------+
3 rows in set (0.00 sec)

mysql> delete from contact_book where firstname='Prachi';
Query OK, 1 row affected (0.01 sec)

mysql> select * from contact_book;
+-----------+----------+-----------+-------------+-------------+--------+-------------+-------------------------+
| firstname | lastname | address   | city        | state       | zip    | phonenumber | email                   |
+-----------+----------+-----------+-------------+-------------+--------+-------------+-------------------------+
| Prajakta  | Tambe    | Kalamboli | Panvel      | Maharashtra | 410218 | 8104706110  | prajtambe@gmail.com     |
| Ruchi     | Mandve   | Sanpada   | Navi Mumbai | Maharashtra | 400705 | 9892735509  | ruchimandve07@gmail.com |
+-----------+----------+-----------+-------------+-------------+--------+-------------+-------------------------+
2 rows in set (0.00 sec)


UC6-Ability to Retrieve
Person belonging to
a City or State from
the Address Book

mysql> select * from contact_book where city='Navi Mumbai' OR state='Maharashtra';
+-----------+----------+-----------+-------------+-------------+--------+-------------+-------------------------+
| firstname | lastname | address   | city        | state       | zip    | phonenumber | email                   |
+-----------+----------+-----------+-------------+-------------+--------+-------------+-------------------------+
| Prajakta  | Tambe    | Kalamboli | Panvel      | Maharashtra | 410218 | 8104706110  | prajtambe@gmail.com     |
| Ruchi     | Mandve   | Sanpada   | Navi Mumbai | Maharashtra | 400705 | 9892735509  | ruchimandve07@gmail.com |
+-----------+----------+-----------+-------------+-------------+--------+-------------+-------------------------+
2 rows in set (0.00 sec)

mysql>


UC7-Ability to understand
the size of address
book by City and State

->mysql> Select city,Count(city) from contact_book group by city;
+-------------+-------------+
| city        | Count(city) |
+-------------+-------------+
| Navi Mumbai |           2 |
| Panvel      |           1 |
+-------------+-------------+
2 rows in set (0.00 sec)

mysql> Select state,Count(state) from contact_book group by state;
+-------------+--------------+
| state       | Count(state) |
+-------------+--------------+
| Maharashtra |            3 |
+-------------+--------------+
1 row in set (0.00 sec)



UC8-Ability to retrieve entries
sorted alphabetically by
Person’s name for a given city

mysql> Select firstname,city from contact_book where city='Navi Mumbai';
+-----------+-------------+
| firstname | city        |
+-----------+-------------+
| Prachi    | Navi Mumbai |
| Ruchi     | Navi Mumbai |
+-----------+-------------+
2 rows in set (0.00 sec)

mysql> Select firstname,city from contact_book where city='Navi Mumbai' order by firstname ASC;
+-----------+-------------+
| firstname | city        |
+-----------+-------------+
| Prachi    | Navi Mumbai |
| Ruchi     | Navi Mumbai |
+-----------+-------------+
2 rows in set (0.00 sec)

mysql> Select firstname,city from contact_book where city='Navi Mumbai' order by firstname DESC;
+-----------+-------------+
| firstname | city        |
+-----------+-------------+
| Ruchi     | Navi Mumbai |
| Prachi    | Navi Mumbai |
+-----------+-------------+
2 rows in set (0.00 sec)


UC 9-Ability to identify each
Address Book with name and Type. - Here the type could Family, Friends,
Profession, etc
- Alter Address Book to add name and type

mysql> Alter table contact_book add name varchar(50) after lastname;
Query OK, 0 rows affected (0.11 sec)
Records: 0  Duplicates: 0  Warnings: 0

mysql> Alter table contact_book add type varchar(50) after name;
Query OK, 0 rows affected (0.08 sec)
Records: 0  Duplicates: 0  Warnings: 0

mysql> describe contact_book
    -> ;
+-------------+-------------+------+-----+---------+-------+
| Field       | Type        | Null | Key | Default | Extra |
+-------------+-------------+------+-----+---------+-------+
| firstname   | varchar(50) | NO   | PRI | NULL    |       |
| lastname    | varchar(50) | YES  |     | NULL    |       |
| name        | varchar(50) | YES  |     | NULL    |       |
| type        | varchar(50) | YES  |     | NULL    |       |
| address     | varchar(50) | YES  |     | NULL    |       |
| city        | varchar(50) | NO   |     | NULL    |       |
| state       | varchar(50) | NO   |     | NULL    |       |
| zip         | int         | NO   |     | NULL    |       |
| phonenumber | varchar(50) | NO   |     | NULL    |       |
| email       | varchar(50) | NO   |     | NULL    |       |
+-------------+-------------+------+-----+---------+-------+
10 rows in set (0.01 sec)


mysql> update contact_book set name='familybook',type='family' where firstname='Prachi' or firstname='Ruchi';
Query OK, 2 rows affected (0.01 sec)
Rows matched: 2  Changed: 2  Warnings: 0

mysql> select * from contact_book;
+-----------+----------+------------+--------+-----------+-------------+-------------+--------+-------------+--------------------------+
| firstname | lastname | name       | type   | address   | city        | state       | zip    | phonenumber | email                    |
+-----------+----------+------------+--------+-----------+-------------+-------------+--------+-------------+--------------------------+
| Prachi    | Mandve   | familybook | family | Vashi     | Navi Mumbai | Maharashtra | 400703 | 9967734725  | prachimandve07@gmail.com |
| Prajakta  | Tambe    | NULL       | NULL   | Kalamboli | Panvel      | Maharashtra | 410218 | 8104706110  | prajtambe@gmail.com      |
| Ruchi     | Mandve   | familybook | family | Sanpada   | Navi Mumbai | Maharashtra | 400705 | 9892735509  | ruchimandve07@gmail.com  |
+-----------+----------+------------+--------+-----------+-------------+-------------+--------+-------------+--------------------------+
3 rows in set (0.00 sec)

mysql> update contact_book set name='friendsbook',type='friends' where firstname='Prajakta';
Query OK, 1 row affected (0.01 sec)
Rows matched: 1  Changed: 1  Warnings: 0

mysql> select * from contact_book;
+-----------+----------+-------------+---------+-----------+-------------+-------------+--------+-------------+--------------------------+
| firstname | lastname | name        | type    | address   | city        | state       | zip    | phonenumber | email                    |
+-----------+----------+-------------+---------+-----------+-------------+-------------+--------+-------------+--------------------------+
| Prachi    | Mandve   | familybook  | family  | Vashi     | Navi Mumbai | Maharashtra | 400703 | 9967734725  | prachimandve07@gmail.com |
| Prajakta  | Tambe    | friendsbook | friends | Kalamboli | Panvel      | Maharashtra | 410218 | 8104706110  | prajtambe@gmail.com      |
| Ruchi     | Mandve   | familybook  | family  | Sanpada   | Navi Mumbai | Maharashtra | 400705 | 9892735509  | ruchimandve07@gmail.com  |
+-----------+----------+-------------+---------+-----------+-------------+-------------+--------+-------------+--------------------------+
3 rows in set (0.00 sec)



UC10-Ability to get number
of contact persons
i.e. count by type

->
mysql> Select type,Count(type) from contact_book group by type;
+---------+-------------+
| type    | Count(type) |
+---------+-------------+
| family  |           2 |
| friends |           1 |
+---------+-------------+
2 rows in set (0.00 sec)




UC11-Ability to add person

to both Friend and Family

mysql> select * from contact_book;
+-----------+----------+-------------+---------+-----------+-------------+-------------+--------+-------------+--------------------------+
| firstname | lastname | name        | type    | address   | city        | state       | zip    | phonenumber | email                    |
+-----------+----------+-------------+---------+-----------+-------------+-------------+--------+-------------+--------------------------+
| Prachi    | Mandve   | familybook  | family  | Vashi     | Navi Mumbai | Maharashtra | 400703 | 9967734725  | prachimandve07@gmail.com |
| Prajakta  | Tambe    | friendsbook | friends | Kalamboli | Panvel      | Maharashtra | 410218 | 8104706110  | prajtambe@gmail.com      |
| Ruchi     | Mandve   | familybook  | family  | Sanpada   | Navi Mumbai | Maharashtra | 400705 | 9892735509  | ruchimandve07@gmail.com  |
+-----------+----------+-------------+---------+-----------+-------------+-------------+--------+-------------+--------------------------+
3 rows in set (0.00 sec)

mysql> insert into contact_book values('Rutuja','Saigaonkar','friendsbook','friends','New Panvel','Panvel','Maharashtra',410216,'8380037719','rutssai@gmail.com');
Query OK, 1 row affected (0.01 sec)

mysql> insert into contact_book values('Pratibha','Mandve','familybook','family','Kothrud','Pune','Maharashtra',405551,'9987365780','pratibha67@gmail.com');
Query OK, 1 row affected (0.01 sec)

mysql> select * from contact_book;
+-----------+------------+-------------+---------+------------+-------------+-------------+--------+-------------+--------------------------+
| firstname | lastname   | name        | type    | address    | city        | state       | zip    | phonenumber | email                    |
+-----------+------------+-------------+---------+------------+-------------+-------------+--------+-------------+--------------------------+
| Prachi    | Mandve     | familybook  | family  | Vashi      | Navi Mumbai | Maharashtra | 400703 | 9967734725  | prachimandve07@gmail.com |
| Prajakta  | Tambe      | friendsbook | friends | Kalamboli  | Panvel      | Maharashtra | 410218 | 8104706110  | prajtambe@gmail.com      |
| Pratibha  | Mandve     | familybook  | family  | Kothrud    | Pune        | Maharashtra | 405551 | 9987365780  | pratibha67@gmail.com     |
| Ruchi     | Mandve     | familybook  | family  | Sanpada    | Navi Mumbai | Maharashtra | 400705 | 9892735509  | ruchimandve07@gmail.com  |
| Rutuja    | Saigaonkar | friendsbook | friends | New Panvel | Panvel      | Maharashtra | 410216 | 8380037719  | rutssai@gmail.com        |
+-----------+------------+-------------+---------+------------+-------------+-------------+--------+-------------+--------------------------+
5 rows in set (0.00 sec)



UC13-
Ensure all retrieve
queries done especially
in UC 6, UC 7, UC 8 and
UC 10 are working with
new table structure


mysql> use addressbook_system;
Database changed
mysql> create table contact
    -> (
    -> ;
ERROR 1064 (42000): You have an error in your SQL syntax; check the manual that corresponds to your MySQL server version for the right syntax to use near '' at line 2
mysql> create table addressbook_type
    -> (
    -> type_id int not null,
    -> ad_type varchar(60) not null,
    -> ad_name varchar(60) not null);
Query OK, 0 rows affected (0.05 sec)

mysql> create table contact
    -> (
    -> contact_id int not null,
    -> firstname varchar(50) not null,
    -> lastname varchar(50) not null,
    -> phone_no varchar(50) not null,
    -> email varchar(60) not null,
    -> primary key(contact_id),
    -> type_id int,
    -> foreign key(type_id) references addressbook_type(type_id));
ERROR 1822 (HY000): Failed to add the foreign key constraint. Missing index for constraint 'contact_ibfk_1' in the referenced table 'addressbook_type'
mysql> create table contact
    -> (
    -> contact_id int not null,
    -> firstname varchar(50) not null,
    -> lastname varchar(50) not null,
    -> phone_no varchar(50) not null,
    -> email varchar(60) not null,
    -> primary key(contact_id),
    -> type_id int,
    -> foreign key(type_id) references addressbook_type(type_id));
ERROR 1822 (HY000): Failed to add the foreign key constraint. Missing index for constraint 'contact_ibfk_1' in the referenced table 'addressbook_type'
mysql> alter table addressbook_type add primary key(type_id);
Query OK, 0 rows affected (0.06 sec)
Records: 0  Duplicates: 0  Warnings: 0

mysql> create table contact
    -> (
    -> contact_id int not null,
    -> firstname varchar(50) not null,
    -> lastname varchar(50) not null,
    -> phone_no varchar(50) not null,
    -> email varchar(60) not null,
    -> primary key(contact_id),
    -> type_id int,
    -> foreign key(type_id) references addressbook_type(type_id));
Query OK, 0 rows affected (0.05 sec)

mysql> create table address
    -> (
    -> address_id int not null,
    -> city varchar(50) not null,
    -> state varchar(50) not null,
    -> zip varchar(50_ not null,
    -> primary key(address_id),
    -> contact_id int,
    -> foreign key(contact_id) references contact(contact_id));
ERROR 1064 (42000): You have an error in your SQL syntax; check the manual that corresponds to your MySQL server version for the right syntax to use near '50_ not null,
primary key(address_id),
contact_id int,
foreign key(contact_id) r' at line 6
mysql> create table address
    -> (
    -> contact_id int not null,
    -> firstname varchar(50) not null,
    -> ;
ERROR 1064 (42000): You have an error in your SQL syntax; check the manual that corresponds to your MySQL server version for the right syntax to use near '' at line 4
mysql> create table address
    -> (
    -> address_id int not null,
    -> city varchar(50) not null,
    -> state varchar(50) not null,
    -> zip varchar(50_ not null,
    -> primary key(address_id),
    -> ;
ERROR 1064 (42000): You have an error in your SQL syntax; check the manual that corresponds to your MySQL server version for the right syntax to use near '50_ not null,
primary key(address_id),' at line 6
mysql> create table address
    -> (
    -> address_id int not null,
    -> city varchar(50) not null,
    -> state varchar(50) not null,
    -> zip varchar(50) not null,
    -> primary key(address_id),
    -> contact_id int,
    -> foreign key(contact_id) references contact(contact_id));
Query OK, 0 rows affected (0.04 sec)

mysql> describe address;
+------------+-------------+------+-----+---------+-------+
| Field      | Type        | Null | Key | Default | Extra |
+------------+-------------+------+-----+---------+-------+
| address_id | int         | NO   | PRI | NULL    |       |
| city       | varchar(50) | NO   |     | NULL    |       |
| state      | varchar(50) | NO   |     | NULL    |       |
| zip        | varchar(50) | NO   |     | NULL    |       |
| contact_id | int         | YES  | MUL | NULL    |       |
+------------+-------------+------+-----+---------+-------+
5 rows in set (0.01 sec)

mysql> describe contact;
+------------+-------------+------+-----+---------+-------+
| Field      | Type        | Null | Key | Default | Extra |
+------------+-------------+------+-----+---------+-------+
| contact_id | int         | NO   | PRI | NULL    |       |
| firstname  | varchar(50) | NO   |     | NULL    |       |
| lastname   | varchar(50) | NO   |     | NULL    |       |
| phone_no   | varchar(50) | NO   |     | NULL    |       |
| email      | varchar(60) | NO   |     | NULL    |       |
| type_id    | int         | YES  | MUL | NULL    |       |
+------------+-------------+------+-----+---------+-------+
6 rows in set (0.00 sec)

mysql> show tables;
+------------------------------+
| Tables_in_addressbook_system |
+------------------------------+
| address                      |
| addressbook_type             |
| contact                      |
+------------------------------+
3 rows in set (0.00 sec)

mysql> describe addressbook_type;
+---------+-------------+------+-----+---------+-------+
| Field   | Type        | Null | Key | Default | Extra |
+---------+-------------+------+-----+---------+-------+
| type_id | int         | NO   | PRI | NULL    |       |
| ad_type | varchar(60) | NO   |     | NULL    |       |
| ad_name | varchar(60) | NO   |     | NULL    |       |
+---------+-------------+------+-----+---------+-------+
3 rows in set (0.00 sec)

mysql> insert into addressbook_type values(1,'FamilyBook','Family');
Query OK, 1 row affected (0.01 sec)

mysql> insert into addressbook_type values(2,'FriendsBook','Friends');
Query OK, 1 row affected (0.01 sec)

mysql> insert into contact values(1,'Ruchi','Mandve','9892735509','ruchimandve07@gmail.com',1);
Query OK, 1 row affected (0.01 sec)

mysql> insert into contact values(2,'Prachi','Mandve','9967734725','prachimandve07@gmail.com',1);
Query OK, 1 row affected (0.01 sec)

mysql> insert into contact values(3,'Prajakta','Tambe','8380037719','prajtambe@gmail.com',2);
Query OK, 1 row affected (0.01 sec)

mysql> select * from contact;
+------------+-----------+----------+------------+--------------------------+---------+
| contact_id | firstname | lastname | phone_no   | email                    | type_id |
+------------+-----------+----------+------------+--------------------------+---------+
|          1 | Ruchi     | Mandve   | 9892735509 | ruchimandve07@gmail.com  |       1 |
|          2 | Prachi    | Mandve   | 9967734725 | prachimandve07@gmail.com |       1 |
|          3 | Prajakta  | Tambe    | 8380037719 | prajtambe@gmail.com      |       2 |
+------------+-----------+----------+------------+--------------------------+---------+
3 rows in set (0.00 sec)

mysql> insert into address values(1,'Navi Mumbai','Maharashtra','400705','9892735509');
ERROR 1264 (22003): Out of range value for column 'contact_id' at row 1
mysql> insert into address values(1,'Navi Mumbai','Maharashtra','400705',1);
Query OK, 1 row affected (0.01 sec)

mysql> insert into address values(2,'Panvel','Maharashtra','410251',3);
Query OK, 1 row affected (0.01 sec)

mysql> insert into address values(3,'Surat','Gujrat','400538',2);
Query OK, 1 row affected (0.01 sec)

mysql> select * from address;
+------------+-------------+-------------+--------+------------+
| address_id | city        | state       | zip    | contact_id |
+------------+-------------+-------------+--------+------------+
|          1 | Navi Mumbai | Maharashtra | 400705 |          1 |
|          2 | Panvel      | Maharashtra | 410251 |          3 |
|          3 | Surat       | Gujrat      | 400538 |          2 |
+------------+-------------+-------------+--------+------------+
3 rows in set (0.00 sec)

mysql> select contact.firstname,contact.lastname,address.city from contact inner join address on address.contact_id=contact.contact_id where address.state='Maharashtra';
+-----------+----------+-------------+
| firstname | lastname | city        |
+-----------+----------+-------------+
| Ruchi     | Mandve   | Navi Mumbai |
| Prajakta  | Tambe    | Panvel      |
+-----------+----------+-------------+
2 rows in set (0.00 sec)

mysql> select * from contact order by name;
ERROR 1054 (42S22): Unknown column 'name' in 'order clause'
mysql> select * from contact order by firstname;
+------------+-----------+----------+------------+--------------------------+---------+
| contact_id | firstname | lastname | phone_no   | email                    | type_id |
+------------+-----------+----------+------------+--------------------------+---------+
|          2 | Prachi    | Mandve   | 9967734725 | prachimandve07@gmail.com |       1 |
|          3 | Prajakta  | Tambe    | 8380037719 | prajtambe@gmail.com      |       2 |
|          1 | Ruchi     | Mandve   | 9892735509 | ruchimandve07@gmail.com  |       1 |
+------------+-----------+----------+------------+--------------------------+---------+
3 rows in set (0.00 sec)

mysql> select * from addressbook_type;
+---------+-------------+---------+
| type_id | ad_type     | ad_name |
+---------+-------------+---------+
|       1 | FamilyBook  | Family  |
|       2 | FriendsBook | Friends |
+---------+-------------+---------+
2 rows in set (0.00 sec)

mysql> select addressbook_type.type_id,addressbook_type.ad_type,addressbook_type.ad_name,count(contact.type_id) from addressbook_type inner join contact on addressbook_type.type_id=contact.type_id;
+---------+------------+---------+------------------------+
| type_id | ad_type    | ad_name | count(contact.type_id) |
+---------+------------+---------+------------------------+
|       1 | FamilyBook | Family  |                      3 |
+---------+------------+---------+------------------------+
1 row in set (0.00 sec)

mysql> select addressbook_type.type_id,addressbook_type.ad_type,addressbook_type.ad_name,count(contact.type_id) from addressbook_type inner join contact on addressbook_type.type_id=contact.type_id group by type_id;
+---------+-------------+---------+------------------------+
| type_id | ad_type     | ad_name | count(contact.type_id) |
+---------+-------------+---------+------------------------+
|       1 | FamilyBook  | Family  |                      2 |
|       2 | FriendsBook | Friends |                      1 |
+---------+-------------+---------+------------------------+
2 rows in set (0.00 sec)
